text_clean	user.screen_name	unique_id	text_clean_english	text_clean_emojistranslated
"bisogna scrivere subito  che non c'è connessione col vaccino   senza aggiungere ""ANCORA,  E CHE LA NEGHEREMO SEMPRE !!!! ""   Miami, morto noto ginecologo. ""Si sentì male 3 giorni dopo il vaccino Pfizer"" -  "	rosaca	M_152	"we must immediately write that there is no connection with the vaccine without adding ""STILL, AND WE WILL ALWAYS DENIAL IT !!!! "" Miami, known gynecologist died. ""He felt sick 3 days after the Pfizer vaccine"" -"	"we must immediately write that there is no connection with the vaccine without adding ""STILL, AND WE WILL ALWAYS DENIAL IT !!!! "" Miami, known gynecologist died. ""He felt sick 3 days after the Pfizer vaccine"" -"
🔴#Piemonte #Covid_19 #31maggio   126 casi positivi su 3.129 tamponi molecolari (4% positivi), 333 guariti e 7 decessi. Crescono le terapie intensive (+1, 81) mentre scendono i ricoveri (-31, 594).  #Vaccinati +28.209 dosi (2.502.536 tot.)   	lucarango88	Q_339	🔴#Piemonte #Covid_19 #31May 126 positive cases out of 3,129 molecular swabs (4% positive), 333 recovered and 7 deaths. Intensive care is growing (+1, 81) while hospitalizations are falling (-31, 594). #Vaccinated +28,209 doses (2,502,536 tot.)	:red_circle:#Piemonte #Covid_19 #31May 126 positive cases out of 3,129 molecular swabs (4% positive), 333 recovered and 7 deaths. Intensive care is growing (+1, 81) while hospitalizations are falling (-31, 594). #Vaccinated +28,209 doses (2,502,536 tot.)
La situazione è molto grave :Reazione avversa di un ragazzino di 12 anni al vaccino CV  in #Malesia #Speranza 	GestriLoris	V_474	The situation is very serious : Adverse reaction of a 12-year-old boy to the CV vaccine in #Malaysia #Hope	The situation is very serious : Adverse reaction of a 12-year-old boy to the CV vaccine in #Malaysia #Hope
BROGLI E NON E' LA PRIMA VOLTA ...IN FRANCIA - CONTINUA LA GUERRA BIOLOGICA DEI VACCINI IN ITALIA...	LICIO15	BB_308	BROGLI AND IT'S NOT THE FIRST TIME... IN FRANCE - THE BIOLOGICAL WAR OF VACCINES CONTINUES IN ITALY...	BROGLI AND IT'S NOT THE FIRST TIME... IN FRANCE - THE BIOLOGICAL WAR OF VACCINES CONTINUES IN ITALY...
Gran Bretagna, crescono contagi e mortalità: «Pesa l’effetto Europei»-  😂😂😂 europei? Vaccino perché non lo dite!!! 	BettaninManuela	T_475	Great Britain, infections and mortality are growing: «The European effect weighs»- 😂😂😂 Europeans? Vaccine why don't you say!!!	Great Britain, infections and mortality are growing: «The European effect weighs»- :face_with_tears_of_joy::face_with_tears_of_joy::face_with_tears_of_joy: Europeans? Vaccine why don't you say!!!
Ho appena ricevuto la quarta dose. Consiglio a tutti di farla per proteggere noi e gli altri. Il covid sta tornando…  La quarta dose è il nostro scudo. I vaccini salvano vite. #quartadose #vaccino #VACCINATEVI	Mion3Luca	GG_253	I just received the fourth dose. I advise everyone to do it to protect us and others. covid is coming back... The fourth dose is our shield. Vaccines save lives. #quartadose #vaccine #VACCIN YOURSELF	I just received the fourth dose. I advise everyone to do it to protect us and others. covid is coming back... The fourth dose is our shield. Vaccines save lives. #quartadose #vaccine #VACCIN YOURSELF
"Piero Angela: “Fidiamoci degli esperti senza cambiare vita”.  Il giornalista: ""Questa è una epidemia seria, ma in attesa del vaccino le cure ci sono e funzionano. Bisogna evitare le fake news che drammatizzano"" #COVIDー19 "	LaPrimaManina	B_48	"Piero Angela: ""Let's trust the experts without changing our lives"". The journalist: ""This is a serious epidemic, but while waiting for the vaccine, the treatments are there and they work. We must avoid the fake news that dramatize"" #COVIDー19"	"Piero Angela: ""Let's trust the experts without changing our lives"". The journalist: ""This is a serious epidemic, but while waiting for the vaccine, the treatments are there and they work. We must avoid the fake news that dramatize"" #COVIDー19"
Ma l'Inghilterra non aveva iniziato il piano vaccinale ? allora il vaccino non funziona se i casi aumentano  #staseraitalia #nonelarena	Ariel2575	L_52	But hadn't England started the vaccination plan? then the vaccine doesn't work if the cases increase #staseraitalia #nonelarena	But hadn't England started the vaccination plan? then the vaccine doesn't work if the cases increase #staseraitalia #nonelarena
Stamattina in strada c'è stavo solo io con la mascherina!😄 non mi sono fatta tutti i vaccini quindi preferisco portarla!😉 non mi da fastidio! Anche perche' il virus e' ancora in giro e voglio star tranquilla!😉	an_gy2289	CC_393	This morning there was only me on the street with a mask! 😄 I haven't had all the vaccines so I prefer to wear it! 😉 it doesn't bother me! Also because the virus is still around and I want to stay calm!😉	This morning there was only me on the street with a mask! :grinning_face_with_smiling_eyes: I haven't had all the vaccines so I prefer to wear it! :winking_face: it doesn't bother me! Also because the virus is still around and I want to stay calm!:winking_face:
"Vaccino Covid, Locatelli: ""Per fine marzo 13 milioni dosi"": Il presidente del Consiglio superiore di sanità: ""Che la variante inglese diventi nella prossima settimana prevalente nel paese è largamente prevedibile""  "	fisco24_info	N_6	"Covid vaccine, Locatelli: ""13 million doses by the end of March"": The president of the Higher Health Council: ""That the English variant will become prevalent in the country next week is largely predictable"""	"Covid vaccine, Locatelli: ""13 million doses by the end of March"": The president of the Higher Health Council: ""That the English variant will become prevalent in the country next week is largely predictable"""
#Sovranisti scatenati perchè le case #farmaceutiche che sperimentano il #vaccino stanno aumentando di valore in #BORSA. Non capiscono che è una buona notizia. Non solo per la cura. Ma anche per tutti quelli, tantissimi, che acquistano i titoli.	AndreaLompio53	B_11	#Sovereignists unleashed because the #pharmaceutical companies experimenting with the #vaccine are increasing in value in the #BASE. They don't understand that it's good news. Not just for the cure. But also for all those, many, who buy the securities.	#Sovereignists unleashed because the #pharmaceutical companies experimenting with the #vaccine are increasing in value in the #BASE. They don't understand that it's good news. Not just for the cure. But also for all those, many, who buy the securities.
MA LA MANIFESTAZIONE X TUTTI I MORTI POST- VACCINO....in ITALIA,quando si fa????? In EUROPA si muovono tutti....NOI STATICI ,COME SEMPRE!!!!!!	CARLA78120656	EE_251	BUT THE EVENT FOR ALL THE DEAD POST-VACCINE.... in ITALY, when is it done????? In EUROPE everyone moves....WE STATICS, AS ALWAYS!!!!!!	BUT THE EVENT FOR ALL THE DEAD POST-VACCINE.... in ITALY, when is it done????? In EUROPE everyone moves....WE STATICS, AS ALWAYS!!!!!!
Quanto manca al termine delle vaccinazioni #AntiCovid?   Con la media attuale di #vaccinazioni ci vorranno 𝟭𝟯𝟬𝟱 𝗴𝗶𝗼𝗿𝗻𝗶 per le prime somministrazioni.  Per i richiami,  𝟵 𝗴𝗶𝗼𝗿𝗻𝗶.  Segui il nostro contatore:   #COVID19 #2febbraio #coronavirus 	Zeta_Luiss	N_242	How long until the end of the #AntiCovid vaccinations? With the current average of #vaccinations, it will take 10,000 for the first administrations. For recalls, 𝟵 𝗴𝗶𝗼𝗿𝗻𝗶. Follow our counter: #COVID19 #2 February #coronavirus	How long until the end of the #AntiCovid vaccinations? With the current average of #vaccinations, it will take 10,000 for the first administrations. For recalls, 𝟵 𝗴𝗶𝗼𝗿𝗻𝗶. Follow our counter: #COVID19 #2 February #coronavirus
