text_clean	user.screen_name	unique_id	text_clean_english	text_clean_emojistranslated
Infatti Pfizer non ha soddisfatto nessuna delle richieste di EMA entro le scadenze prefissate, con ragioni non del tutto trasparenti, alimentando speculazioni circa la presenza nel vaccino Comirnaty di componenti non adatti all'uso nell'uomo che causerebbero reazioni allergiche. 	Mr_Ozymandias	Z_27	In fact, Pfizer has not satisfied any of the EMA requests within the set deadlines, for reasons that are not entirely transparent, fueling speculation about the presence in the Comirnaty vaccine of components not suitable for use in humans which would cause allergic reactions.	In fact, Pfizer has not satisfied any of the EMA requests within the set deadlines, for reasons that are not entirely transparent, fueling speculation about the presence in the Comirnaty vaccine of components not suitable for use in humans which would cause allergic reactions.
"Coronavirus #Roma, Nicola Zingaretti : ""Vaccino va prodotto su suolo italiano"". DIRETTA "	SkyTG24	F_492	"Coronavirus #Rome, Nicola Zingaretti: ""Vaccine must be produced on Italian soil"". DIRECT"	"Coronavirus #Rome, Nicola Zingaretti: ""Vaccine must be produced on Italian soil"". DIRECT"
Speravo che il vaccino mi inoculasse la voglia di studiare ma a quanto pare non è andata così	vieniasalvarmi	R_11	I was hoping that the vaccine would inoculate me with the desire to study but apparently it didn't go like this	I was hoping that the vaccine would inoculate me with the desire to study but apparently it didn't go like this
Ormai posso definirmi COVID FREE....seconda dose vaccino fatta.... raga vaccinatevi solo così ne usciamo 💪❤️💪 ABRACCIO 🤗 @ Naples, Italy 	dragoie	Q_477	By now I can call myself COVID FREE.... second vaccine dose done.... guys get vaccinated just so we can get out of it 💪❤️💪 HUGS 🤗 @ Naples, Italy	By now I can call myself COVID FREE.... second vaccine dose done.... guys get vaccinated just so we can get out of it :flexed_biceps::red_heart::flexed_biceps: HUGS :smiling_face_with_open_hands: @ Naples, Italy
Chissà? Forse un giorno qualcuno inventerà un vaccino contro l'idiozia. Ma anche allora, coloro che ne avrebbero bisogno lo rifiuteranno. Boh!? &gt;&gt; L’ inutile caccia all’untore 	gianpadano	B_465	Maybe? Maybe one day someone will invent a vaccine against idiocy. But even then, those who need it will reject it. I don't know!? &gt;&gt; The useless hunt for the infector	Maybe? Maybe one day someone will invent a vaccine against idiocy. But even then, those who need it will reject it. I don't know!? &gt;&gt; The useless hunt for the infector
"Vaccino anti covid in azienda, i ""big"" liguri si preparano: ecco come funzionerà "	infoitinterno	P_73	"Anti-covid vaccine in the company, the Ligurian ""big"" are preparing: this is how it will work"	"Anti-covid vaccine in the company, the Ligurian ""big"" are preparing: this is how it will work"
 - e pure questo vaccino..	Sfn1974	J_59	- and this vaccine too..	- and this vaccine too..
Ragazza che si è fatta il vaccino oggi alle 11 e 30 seduta affianco a me , sappi che mi sono innamorato &lt;3	GiannaceNicola	V_429	Girl who got the vaccine today at 11.30 sitting next to me, know that I fell in love &lt;3	Girl who got the vaccine today at 11.30 sitting next to me, know that I fell in love &lt;3
EMA e FDA chiamano “quarta dose” il nuovo vaccino Ba1 uscito lunedì, la vostra “quarta dose” cos’era?  LO VOGLIAMO SAPERE ADESSO!  🟡 SEGUICI SU CONSENSO DISINFORMATO	MariaDellaMoni6	FF_186	EMA and FDA call the new Ba1 vaccine released on Monday a “fourth dose”, what was your “fourth dose”? WE WANT TO KNOW NOW! 🟡 FOLLOW US ON UNINFORMED CONSENT	EMA and FDA call the new Ba1 vaccine released on Monday a “fourth dose”, what was your “fourth dose”? WE WANT TO KNOW NOW! :yellow_circle: FOLLOW US ON UNINFORMED CONSENT
Non ho ne’ prove ne’ indizi, come diceva #Pasolini ma ipotizzo che il #vaccino ci sia già. Aspettano che l’economia vada a rotoli, che i morti aumentino, i supermercati si svuotino. Ci scanneremo per la mascherina e per l’Amuchina. Insomma, fanno ingrassare i porci. #coronavirus	_antoniocannone	C_2	I have no evidence or clues, as #Pasolini said but I assume that the #vaccine is already there. They wait for the economy to crash, for the dead to increase, for the supermarkets to empty. We will scan ourselves for the mask and for the Amuchina. In short, they make pigs fat. #coronavirus	I have no evidence or clues, as #Pasolini said but I assume that the #vaccine is already there. They wait for the economy to crash, for the dead to increase, for the supermarkets to empty. We will scan ourselves for the mask and for the Amuchina. In short, they make pigs fat. #coronavirus
Passi in avanti per il vaccino contro il Covid-19, ok ai test pre-clinici in Italia 	CanaleSeiTv	C_136	Steps forward for the vaccine against Covid-19, ok for pre-clinical tests in Italy	Steps forward for the vaccine against Covid-19, ok for pre-clinical tests in Italy
Vaccino antinfluenzale universale? Non è più fantascienza  	Everyeye	HH_309	Universal flu vaccine? It's not science fiction anymore	Universal flu vaccine? It's not science fiction anymore
COVID-19 in Piemonte: 33386 dosi di vaccino somministrate | 27 luglio 2021 	astigov	S_491	COVID-19 in Piedmont: 33386 vaccine doses administered | July 27, 2021	COVID-19 in Piedmont: 33386 vaccine doses administered | July 27, 2021
Libertà, Libertà e poi aggrediscono i cronisti nel pieno esercizio delle loro libertà costituzionali. Tutto bene, #novax?   	GianluGatti	T_381	Freedom, Freedom and then attack the reporters in the full exercise of their constitutional freedoms. Are you okay, #novax?	Freedom, Freedom and then attack the reporters in the full exercise of their constitutional freedoms. Are you okay, #novax?
LN Anche il vaccino anti-Covid della statunitense Moderna si mostra efficace nel 94,5% dei casi. Fauci: “Davvero una buona notizia. Percentuale impressionante”  	MPenikas	K_46	LN Even the anti-Covid vaccine from the US Moderna is effective in 94.5% of cases. Fauci: “Really good news. Impressive percentage”	LN Even the anti-Covid vaccine from the US Moderna is effective in 94.5% of cases. Fauci: “Really good news. Impressive percentage”
Dato che si è creato un parallelismo tra pro-Vax e pro-Nato, vorrei far presente che chi vuole l’intervento militare è lo stesso che indossa la mascherina da solo in macchina.  #EcoDelleScatoleCraniche	A_DIngiandi	AA_257	Given that a parallelism has been created between pro-Vax and pro-Nato, I would like to point out that those who want military intervention are the same ones who wear the mask alone in the car. #EcoDelleScatoleCraniche	Given that a parallelism has been created between pro-Vax and pro-Nato, I would like to point out that those who want military intervention are the same ones who wear the mask alone in the car. #EcoDelleScatoleCraniche
#Lariachetira perché questa anchorwoman interrompe sempre chi sta parlando, come ha appena fatto con la dottoressa che spiegava che non bisognava illudersi sul numero dei richiedenti il vaccino dando le cifre che la Merlino mi ha impedito di sentire perchè taglia la parola ?!	fcterni	J_324	#Lariachetira because this anchorwoman always interrupts whoever is speaking, as she just did with the doctor who explained that we shouldn't delude ourselves about the number of vaccine applicants by giving the figures that Merlino prevented me from hearing because she cuts the word?!	#Lariachetira because this anchorwoman always interrupts whoever is speaking, as she just did with the doctor who explained that we shouldn't delude ourselves about the number of vaccine applicants by giving the figures that Merlino prevented me from hearing because she cuts the word?!
Crisanti, senza dati a disposizione, io non farei il primo vaccino che dovesse arrivare a gennaio. Perché vorrei essere sicuro che questo vaccino sia stato opportunamente testato e che soddisfi tutti i criteri di sicurezza ed efficacia. Lha detto, 😧 	stefmat1824	K_218	Crisanti, without available data, I would not make the first vaccine that should arrive in January. Because I would like to be sure that this vaccine has been properly tested and that it meets all the safety and efficacy criteria. He said it, 😧	Crisanti, without available data, I would not make the first vaccine that should arrive in January. Because I would like to be sure that this vaccine has been properly tested and that it meets all the safety and efficacy criteria. He said it, :anguished_face:
Mia madre, ha preso il covid già da una settimana, fortunatamente sintomi lievi ci siamo isolati tutti e lei ancora di più, nessuno di noi lo ha preso lei afferma, sono stata peggio dopo le somministrazioni di tutte e tre le dosi di vaccino	mariagrosso	CC_51	My mother had already caught the covid for a week, fortunately with mild symptoms we all isolated ourselves and she even more, none of us caught it she says, I was worse after the administration of all three doses of the vaccine	My mother had already caught the covid for a week, fortunately with mild symptoms we all isolated ourselves and she even more, none of us caught it she says, I was worse after the administration of all three doses of the vaccine
Giornale di Sicilia: Palermo, stop al commissario Covid: smantellato l’hub dei vaccini alla Fiera. 	MicheleFesta85	II_110	Giornale di Sicilia: Palermo, stop for the Covid commissioner: the vaccine hub at the Fair dismantled.	Giornale di Sicilia: Palermo, stop for the Covid commissioner: the vaccine hub at the Fair dismantled.
C'è una pandemia e il governo si permette di fare lo schizzinoso sul vaccino Sputnik solo perché è Russo. 🙃	noitre32	P_466	There is a pandemic and the government allows itself to be picky about the Sputnik vaccine just because it is Russian. 🙃	There is a pandemic and the government allows itself to be picky about the Sputnik vaccine just because it is Russian. :upside-down_face:
Vaccini: al via nel Lazio quarta dose a fragili, prima in Italia. La somministrazione è partita a Rieti e Frosinone #ANSA 	AnsaRomaLazio	Z_167	Vaccines: fourth dose to fragile at the start in Lazio, first in Italy. The administration started in Rieti and Frosinone #ANSA	Vaccines: fourth dose to fragile at the start in Lazio, first in Italy. The administration started in Rieti and Frosinone #ANSA
Intanto i vaccinati potranno festeggiare #capodanno nelle #discoteche con gli amici. Grazie ai #vaccini è tornato tutto alla normalità... seh come no! Che brutta favola quella che raccontano il #governo e i #giornalisti. #italia #draghistan #megagreenpass #greenpass	Alefior87	W_241	Meanwhile the vaccinated will be able to celebrate #New Year's Eve in #discos with friends. Thanks to the #vaccines everything is back to normal... yeah right! What a bad story the #government and #journalists tell. #italy #draghistan #megagreenpass #greenpass	Meanwhile the vaccinated will be able to celebrate #New Year's Eve in #discos with friends. Thanks to the #vaccines everything is back to normal... yeah right! What a bad story the #government and #journalists tell. #italy #draghistan #megagreenpass #greenpass
Cambierà il piano vaccinale. Vaccinazioni di massa entro Maggio 	ForestaliNews	Q_77	The vaccination plan will change. Mass vaccinations by May	The vaccination plan will change. Mass vaccinations by May
Silvio Garattini: “Troppi morti per lasciar circolare Omicron, proteggiamoci in attesa del nuovo vaccino” 	mattinodipadova	EE_309	"Silvio Garattini: ""Too many deaths to let Omicron circulate, let's protect ourselves while waiting for the new vaccine"""	"Silvio Garattini: ""Too many deaths to let Omicron circulate, let's protect ourselves while waiting for the new vaccine"""
Ma Gloria è grande e vaccinate eh!   #uominiedonne 	1bluemi	HH_400	But Gloria is big and vaccinated eh! #men and women	But Gloria is big and vaccinated eh! #men and women
Coronavirus: Martella, 'la buona informazione è il primo vaccino'  #notizie #sapevatelo	notizieit	B_297	Coronavirus: Martella, 'good information is the first vaccine' #news #sapevatelo	Coronavirus: Martella, 'good information is the first vaccine' #news #sapevatelo
E io che pensavo che in #Ucraina col 37% di vaccinati, fossero tutti morti...	JulesDalBon	AA_127	And I thought that in #Ukraine with 37% of vaccinated, they were all dead...	And I thought that in #Ukraine with 37% of vaccinated, they were all dead...
Vaccini anti Covid-19 anche per i cittadini settantenni  #vaccino #vaccini #Sicilia #Sicily #vaccinazione #vaccination #vaccine #vaccinated #SARSCoV2 #SARS_CoV_2 #coronavirus #Covid_19 #COVIDー19 #COVID #COVID19Vaccine #CovidVaccine #Italia  #Italy	EmmeReports	O_475	Anti Covid-19 vaccines also for seventy-year-old citizens	Anti Covid-19 vaccines also for seventy-year-old citizens
Scusate la domanda da bionda.  Avete visto i video con la simulazione della diffusione del contagio (luoghi aperti e chiusi)?  Se sì, indipendentemente dalle linee guida, lo capite da soli che molte cose non si potranno fare o avete intenzione di far polemiche fino al vaccino?	swamilee	E_388	Sorry for the blonde question. Have you seen the videos with the simulation of the spread of the contagion (open and closed places)? If yes, regardless of the guidelines, do you understand for yourself that many things cannot be done or do you intend to cause controversy until the vaccine?	Sorry for the blonde question. Have you seen the videos with the simulation of the spread of the contagion (open and closed places)? If yes, regardless of the guidelines, do you understand for yourself that many things cannot be done or do you intend to cause controversy until the vaccine?
Uno scenario che già si è avverato e può solo gonfiarsi è quello di cittadini ed emigrati della stessa regione, uno contro l' Sardegna abbiamo già sardi contro altri emigrati sardi che vogliono tornare in vacanza.Per l'odio sociale non c'è vaccino a breve	core2design	E_464	A scenario that has already come true and can only inflate is that of citizens and emigrants from the same region, one against Sardinia we already have Sardinians against other Sardinian emigrants who want to go back on holiday. There is no vaccine for social hatred short	A scenario that has already come true and can only inflate is that of citizens and emigrants from the same region, one against Sardinia we already have Sardinians against other Sardinian emigrants who want to go back on holiday. There is no vaccine for social hatred short
 perche Speranza è vaccinato? i politici sono vaccinati tranne qualcuno? armiamoci e ... andate e trovano milioni di strunz che.... vanno	5Ricomincio	CC_6	why is Speranza vaccinated? are politicians vaccinated except for someone? let's arm ourselves and ... go and find millions of strunz that .... go	why is Speranza vaccinated? are politicians vaccinated except for someone? let's arm ourselves and ... go and find millions of strunz that .... go
Covid19, crollano i contagi e le vaccinazioni a Siracusa 	telodogratis	AA_317	Covid19, infections and vaccinations collapse in Syracuse	Covid19, infections and vaccinations collapse in Syracuse
"New Tumblr post: ""CANADA: PRIMO CASO DI RISARCIMENTO :"" DANNO DA VACCINO"""" -   IFTTT,"	cnitalia1	DD_497	"New Tumblr post: ""CANADA: FIRST COMPENSATION CASE :""VACCINE DAMAGE"""" - IFTTT,"	"New Tumblr post: ""CANADA: FIRST COMPENSATION CASE :""VACCINE DAMAGE"""" - IFTTT,"
"Obama: ""Nonostante il fatto che ora abbiamo essenzialmente testato, clinicamente, il vaccino su miliardi di persone nel mondo; circa 1 americano su 5 si metterà ancora a rischio... piuttosto che farsi vaccinare"". 🤡🤡💩💩💩 "	Peter20371	BB_41	"Obama: ""Despite the fact that we have now essentially, clinically tested, the vaccine on billions of people around the world; approximately 1 in 5 Americans will still put themselves at risk... rather than get vaccinated."" 🤡🤡💩💩💩"	"Obama: ""Despite the fact that we have now essentially, clinically tested, the vaccine on billions of people around the world; approximately 1 in 5 Americans will still put themselves at risk... rather than get vaccinated."" :clown_face::clown_face::pile_of_poo::pile_of_poo::pile_of_poo:"
Delusi perchè speravano in più morti a Natale, sto osservando un cospicuo rigurgito di NoVax/NoGP che scassano la minchia con il loro “memento mori” o cercano di vendere intrugli purificanti dal grafene. Dato che mi infastidiscono, li blocco al volo. Sono una brutta persona	JackRya27121132	II_291	"Disappointed because they hoped for more deaths at Christmas, I'm observing a conspicuous regurgitation of NoVax / NoGP who break the fuck with their ""memento mori"" or try to sell graphene purifying concoctions. Since they annoy me, I block them on the fly. I'm a bad person"	"Disappointed because they hoped for more deaths at Christmas, I'm observing a conspicuous regurgitation of NoVax / NoGP who break the fuck with their ""memento mori"" or try to sell graphene purifying concoctions. Since they annoy me, I block them on the fly. I'm a bad person"
Dichiaro la resa. D’ora in avanti ai no mask, no vax, negazionisti del virus e complottisti assortiti risponderò semplicemente con un sonoro e accorato “MA VAFFANCULO!” #lamisuraécolma	reservoirdogs85	I_300	"I declare surrender. From now on to the no mask, no vax, virus deniers and assorted conspiracy theorists I will simply respond with a loud and heartfelt ""FUCK YOU!"" #themeasurement is full"	"I declare surrender. From now on to the no mask, no vax, virus deniers and assorted conspiracy theorists I will simply respond with a loud and heartfelt ""FUCK YOU!"" #themeasurement is full"
"Vaccino contro il Covid? ""Attenti alle scorciatoie"", avverte Crisanti "	sulsitodisimone	G_56	"Vaccine against Covid? ""Beware of shortcuts,"" warns Crisanti"	"Vaccine against Covid? ""Beware of shortcuts,"" warns Crisanti"
volete prendere il massimo di insulti oggi ? Allora ripetete con me: -la terra non è piatta -amo la figa -sono #Over50 -non mi vaccino per libera scelta -leggo #Dostoevskij -ho due lauree -DICO NO ALL’INVIO DI ARMI ALL #Ukraine -considero #Dimaio incapace e #Salvini un pirla	zevunderskin	AA_203	do you want to take the maximum of insults today? So repeat with me: - the earth is not flat - I love pussy - I'm #Over50 - I don't get vaccinated for free choice - I read #Dostoevsky - I have two degrees - I SAY NO TO SENDING WEAPONS ALL #Ukraine - I consider #Dimaio incapable and #Salvini an idiot	do you want to take the maximum of insults today? So repeat with me: - the earth is not flat - I love pussy - I'm #Over50 - I don't get vaccinated for free choice - I read #Dostoevsky - I have two degrees - I SAY NO TO SENDING WEAPONS ALL #Ukraine - I consider #Dimaio incapable and #Salvini an idiot
"Rasi su Skytg24: Troppo clamore mediatico su reazioni avverse Scelta di sospendere vaccinazioni basata su emotività  Novax che vogliono rallentare la campagna vaccinale Giusto scudo penale per medici ed aziende ..ah, dallo studio lo chiamavano ""professore""  #AstraZeneca"	tiecolino	O_219	"Rasi on Skytg24: Too much media hype about adverse reactions Choice to suspend vaccinations based on emotion Novax who want to slow down the vaccination campaign Right criminal shield for doctors and companies ..ah, from the studio they called him ""professor"" #AstraZeneca"	"Rasi on Skytg24: Too much media hype about adverse reactions Choice to suspend vaccinations based on emotion Novax who want to slow down the vaccination campaign Right criminal shield for doctors and companies ..ah, from the studio they called him ""professor"" #AstraZeneca"
"Usa, Biden: ""I politici non devono interferire con il vaccino""  #usa  "	MediasetTgcom24	I_58	"Usa, Biden: ""Politicians must not interfere with the vaccine"" #usa"	"Usa, Biden: ""Politicians must not interfere with the vaccine"" #usa"
Abbiamo dieci milioni di dosi di vaccino. Consiglierei- pur lasciando priorità per le prime dosi e per le terze dosi per i fragili - di partire SUBITO  con la terza dose per i sanitari. Infezioni anche lievi causerebbero quarantene che sguarnirebbero ospedali e ambulatorî.	RobertoBurioni	U_59	We have ten million doses of vaccine. I would recommend - while leaving priority for the first doses and third doses for the frail - to start NOW with the third dose for health care. Even minor infections would cause quarantines that would deprive hospitals and clinics.	We have ten million doses of vaccine. I would recommend - while leaving priority for the first doses and third doses for the frail - to start NOW with the third dose for health care. Even minor infections would cause quarantines that would deprive hospitals and clinics.
A Como si lamentano che le scritte dei #ViVi non vengono cancellate! Forse qualcuno, oltre ai V_V, ritiene abbiano una funzione sociale necessaria! #ilvaccinouccide  #iosononovax   👆👆👆👆👆👆👆👆👆  	martina_ever	Y_309	In Como they complain that the #ViVi writings are not deleted! Perhaps someone, in addition to V_V, believes they have a necessary social function! #ilvaccinokills #iosononovax 👆👆👆👆👆👆👆👆👆	In Como they complain that the #ViVi writings are not deleted! Perhaps someone, in addition to V_V, believes they have a necessary social function! #ilvaccinokills #iosononovax :backhand_index_pointing_up::backhand_index_pointing_up::backhand_index_pointing_up::backhand_index_pointing_up::backhand_index_pointing_up::backhand_index_pointing_up::backhand_index_pointing_up::backhand_index_pointing_up::backhand_index_pointing_up:
#Djokovic commenta la decisione dell'Australia di concedergli l'ingresso anche da non vaccinato grazie ad una esenzione medica.   #AustralianOpen 	FabioRussello	Y_391	#Djokovic comments on Australia's decision to grant him entry even as an unvaccinated thanks to a medical exemption. #AustralianOpen	#Djokovic comments on Australia's decision to grant him entry even as an unvaccinated thanks to a medical exemption. #AustralianOpen
Ho ancora la febbre (belli i vaccini di venerdì che ti caxziano il weekend), stasera abbiamo una prenotazione ad un ristorante fatta una settimana fa perché volevamo andarci tipo da mesi, ho deciso che ci andrò a costo di bere t4chipirina al posto del vino 	r4vi30	DD_464	I still have a fever (Friday's vaccines are nice, they kill you at the weekend), tonight we have a reservation at a restaurant made a week ago because we've been wanting to go there for months, I've decided that I'll go there at the cost of drinking t4chipirina instead of wine	I still have a fever (Friday's vaccines are nice, they kill you at the weekend), tonight we have a reservation at a restaurant made a week ago because we've been wanting to go there for months, I've decided that I'll go there at the cost of drinking t4chipirina instead of wine
Renzi insiste sul vaccino Serve una cura per ripartire subito, cazzo Non una cosa forse utile tra mesi   #NonelArena	tiecolino	C_331	Renzi insists on the vaccine We need a cure to start again damn soon Not something maybe useful in months #NonelArena	Renzi insists on the vaccine We need a cure to start again damn soon Not something maybe useful in months #NonelArena
Via libera ai vaccini anti COVID per bambini da 6 mesi a 5 anni. Dai un'occhiata al video di osintleaks! #TikTok 	datanalysis1	GG_18	Green light to COVID vaccines for children from 6 months to 5 years. Check out the osintleaks video! #TikTok	Green light to COVID vaccines for children from 6 months to 5 years. Check out the osintleaks video! #TikTok
Delusa, avvilita, amareggiata, stufa, incazzata....non andrò mai più a votare! Questa teppaglia non merita più nemmeno un attimo del mio tempo  #NoGreenPassObbligatorio #novax	chlarav	U_150	Disappointed, dejected, embittered, fed up, pissed off....I'll never go to vote again! This thug doesn't deserve even a moment of my time anymore #NoGreenPassObligatorio #novax	Disappointed, dejected, embittered, fed up, pissed off....I'll never go to vote again! This thug doesn't deserve even a moment of my time anymore #NoGreenPassObligatorio #novax
«I vaccini sono pericolosi»: così la giudice di Firenze reintegra al lavoro la psicologa no vax 	Corriere	EE_180	Vaccines are dangerous: thus the judge of Florence reinstates the no-vax psychologist to work	Vaccines are dangerous: thus the judge of Florence reinstates the no-vax psychologist to work
L'efficacia del vaccino è così alta che si possono presentare subito le carte per l'autorizzazione  Pier Luigi Lopalco #Staseraitalia 	StaseraItalia	K_148	The effectiveness of the vaccine is so high that the authorization papers can be presented immediately Pier Luigi Lopalco #Staseraitalia	The effectiveness of the vaccine is so high that the authorization papers can be presented immediately Pier Luigi Lopalco #Staseraitalia
Secondo voi, il ripugnante #Draghi quanto ci farà’ col business vaccini? Quanti zeri? 	NSegreta	V_467	In your opinion, how much will the repulsive #Dragons do with the vaccine business? How many zeros?	In your opinion, how much will the repulsive #Dragons do with the vaccine business? How many zeros?
Un Italiano su 2 non vuole fare il vaccino, perché é convinto che non serve a nulla, lo dicono illustri prof. come Montanari, Tarro, Bacco ecc. 	Euseb53	F_332	One Italian out of 2 does not want to get the vaccine, because he is convinced that it is useless, illustrious professors say. such as Montanari, Tarro, Bacchus etc.	One Italian out of 2 does not want to get the vaccine, because he is convinced that it is useless, illustrious professors say. such as Montanari, Tarro, Bacchus etc.
