text_clean	user.screen_name	unique_id	text_clean_english	text_clean_emojistranslated
"Marco Rizzo-PC:  Speranza ha fatto un esperimento di controllo sociale con i vaccini, e contro ...""  22"	TommyBrain	II_167	"Marco Rizzo-PC: Speranza made an experiment of social control with vaccines, and against ..."" 22"	"Marco Rizzo-PC: Speranza made an experiment of social control with vaccines, and against ..."" 22"
DIARIO USA/ Biden, Trump, vax e no, Nba, Cnn: buon Natale a noi, poveri e fragili 	KattInForma	W_60	USA DIARY/ Biden, Trump, vax and no, Nba, Cnn: Merry Christmas to us, poor and fragile	USA DIARY/ Biden, Trump, vax and no, Nba, Cnn: Merry Christmas to us, poor and fragile
Il #coronavirus non è pericoloso, il #vaccino sì: la verità di un bestseller tedesco che sconvolge i piani per sconfiggere il Covid  	GiancarloDeRisi	I_131	The #coronavirus is not dangerous, the #vaccine is: the truth of a German bestseller that upsets plans to defeat Covid	The #coronavirus is not dangerous, the #vaccine is: the truth of a German bestseller that upsets plans to defeat Covid
Coronavirus latest: China vaccine 78% effective in Brazil trial - Nikkei Asia 	ChinaFansclub	M_188	Coronavirus latest: China vaccine 78% effective in Brazil trial - Nikkei Asia	Coronavirus latest: China vaccine 78% effective in Brazil trial - Nikkei Asia
Ricominciano. Boicottaggio su tutta la linea! 	PortoFedora	CC_378	They start again. Boycott across the board!	They start again. Boycott across the board!
Sto provando a prenotare su regione Lazio il vaccino ma è un Fake ... ho clikkato su 3 date diverse 10/16/21 aprile su tre siti diversi da Roma 1 fino a Roma 3 e mi dice che c è già una prenotazione in atto 😳😳😳. La disponibilità la dà il software non la scelgo io	alessan47586283	P_178	I'm trying to book the vaccine on the Lazio region but it's a Fake ... I clicked on 3 different dates 10/16/21 April on three different sites from Rome 1 to Rome 3 and it tells me that there is already a reservation in progress 😳😳😳. The software gives me availability, I don't choose it	I'm trying to book the vaccine on the Lazio region but it's a Fake ... I clicked on 3 different dates 10/16/21 April on three different sites from Rome 1 to Rome 3 and it tells me that there is already a reservation in progress :flushed_face::flushed_face::flushed_face:. The software gives me availability, I don't choose it
Secondo me stanno già producendo un vaccino a forma di supposta	BrugolaDigitAle	N_220	In my opinion they are already producing a vaccine in the form of a suppository	In my opinion they are already producing a vaccine in the form of a suppository
Vaccini. Gimbe: “Il governo non ha un piano per l’inverno” 	news_mondo_h24	FF_192	"Vaccines. Gimbe: ""The government does not have a plan for the winter"""	"Vaccines. Gimbe: ""The government does not have a plan for the winter"""
Vaccino italiano, funzionano anticorpi CLICCA PER LEGGERE 	Lasiciliaweb	E_301	Italian vaccine, antibodies work CLICK TO READ	Italian vaccine, antibodies work CLICK TO READ
"Il vaccino c'è: è la globalizzazione  Cerasa, un genio prestato al ""giornalismo"" "	OlimpiaOlimpo	A_409	"There is a vaccine: it is globalization Cerasa, a genius lent to ""journalism"""	"There is a vaccine: it is globalization Cerasa, a genius lent to ""journalism"""
Gran parte degli italiani in giallo, assapora uno scampolo di normalità. Non Basilicata, Calabria, Puglia, Sicilia, Sardegna e Valle d'Aosta per una settimana ancora. Qualcuno delle Regioni e Comuni vuole fare mea culpa? Errori/malaffare sui vaccini, no controlli su popolazione	AlessLongo	P_133	Most of the Italians in yellow, savor a remnant of normality. Not Basilicata, Calabria, Puglia, Sicily, Sardinia and Valle d'Aosta for one more week. Does anyone from the Regions and Municipalities want to do mea culpa? Vaccine errors / malfeasance, no population controls	Most of the Italians in yellow, savor a remnant of normality. Not Basilicata, Calabria, Puglia, Sicily, Sardinia and Valle d'Aosta for one more week. Does anyone from the Regions and Municipalities want to do mea culpa? Vaccine errors / malfeasance, no population controls
Coronavirus Roma, al via allo Spallanzani la sperimentazione del vaccino sull'uomo  	ItaliaNEWS	H_324	Coronavirus Rome, the experimentation of the vaccine on humans is underway at Spallanzani	Coronavirus Rome, the experimentation of the vaccine on humans is underway at Spallanzani
STUDIO BATTAGLIA: DAL 15 MARZO LE AVVOCATE DI RAI1 TRA DIVORZI, VACCINI E ADOZIONI 	bubinoblog	AA_399	STUDIO BATTAGLIA: RAI1 LAWYERS BETWEEN DIVORCES, VACCINES AND ADOPTIONS FROM MARCH 15TH	STUDIO BATTAGLIA: RAI1 LAWYERS BETWEEN DIVORCES, VACCINES AND ADOPTIONS FROM MARCH 15TH
Breve storia triste di un incontro con un amico che non vedi da anni. Io: Ciao come va? Lui: bene, ma lo hai fatto il vaccino? Io: No e nemmeno lo farò. Lui: ma che sei un coglione negazionista? Io: Ciao! ..... 😡	StefanoDiFran11	R_355	Short sad story about meeting a friend you haven't seen for years. Me: Hi how are you? Him: fine, but did you get the vaccine? Me: No and I won't either. Him: what are you a denialist asshole? Me: Hello! ..... 😡	Short sad story about meeting a friend you haven't seen for years. Me: Hi how are you? Him: fine, but did you get the vaccine? Me: No and I won't either. Him: what are you a denialist asshole? Me: Hello! ..... :pouting_face:
Il vaccino di AstraZeneca utilizza un adenovirus di scimmia che condivide un gene con il coronavirus Covid-19. A differenza del colpo di AstraZeneca, lo Sputnik V russo, il primo vaccino registrato al mondo, utilizza gli adenovirus umani come vettore, un approccio ampiamente.....	cinzia_palmacci	I_460	AstraZeneca's vaccine uses a monkey adenovirus that shares a gene with the Covid-19 coronavirus. Unlike AstraZeneca's coup, Russia's Sputnik V, the world's first registered vaccine, uses human adenoviruses as a vector, an approach widely…	AstraZeneca's vaccine uses a monkey adenovirus that shares a gene with the Covid-19 coronavirus. Unlike AstraZeneca's coup, Russia's Sputnik V, the world's first registered vaccine, uses human adenoviruses as a vector, an approach widely…
Podríamos tomarnos el día de trabajo lxs que tenemos la vacuna rusa ya que el mundo nos odia?	LuCocomiel	Z_314	Could we take the day off work who have the Russian vaccine since the world hates us?	Could we take the day off work who have the Russian vaccine since the world hates us?
Fate parlare di più la Lorenzin 🐐 e anche Fauci ti diventa no-vax   #Piazzapulita	rramanz	X_24	Make Lorenzin talk more 🐐 and even Fauci becomes no-vax #Piazzapulita	Make Lorenzin talk more :goat: and even Fauci becomes no-vax #Piazzapulita
Tornando alle cose serie. Questa è una carestia! Non esiste!  Sono in crisi! Ho voglia di tornare a limonare, oh! Quando lo trovate sto vaccino? Non so fino a che punto riusciró a trattenere il mio accappatoio. Qui c'è bisogno di figa #pandemia #CoronaVirusitaly	TheDarioLeo	C_31	Back to serious stuff. This is a famine! Does not exist! I'm in crisis! I want to go back to making out, oh! When do you find this vaccine? I don't know how far I will be able to hold on to my bathrobe. We need some pussy here #pandemic #CoronaVirusitaly	Back to serious stuff. This is a famine! Does not exist! I'm in crisis! I want to go back to making out, oh! When do you find this vaccine? I don't know how far I will be able to hold on to my bathrobe. We need some pussy here #pandemic #CoronaVirusitaly
"Una loro riduzione, fra le varie cause, può essere provocata come reazione dell’organismo all’assunzione di alcuni farmaci, quindi, nel caso attuale, nell’inoculazione di un vaccino.""  📚 Unisciti a STUDI SCIENTIFICI"	SoleInvitto	BB_223	"Their reduction, among the various causes, can be caused as a reaction of the body to the intake of some drugs, therefore, in the current case, in the inoculation of a vaccine."" 📚 Join SCIENTIFIC STUDIES"	"Their reduction, among the various causes, can be caused as a reaction of the body to the intake of some drugs, therefore, in the current case, in the inoculation of a vaccine."" :books: Join SCIENTIFIC STUDIES"
[4/n] Ya sea por infección, por vacunación (al menos por un tiempo) o por muerte, parte de la población no puede contagiar más. Mientras tanto, en el tiempo, vamos a seguir contabilizando muertes (triste, pero un hecho).	federicolois	H_57	[4/n] Either by infection, by vaccination (at least for a while) or by death, part of the population can no longer infect. Meanwhile, in time, we will continue to count deaths (sad, but a fact).	[4/n] Either by infection, by vaccination (at least for a while) or by death, part of the population can no longer infect. Meanwhile, in time, we will continue to count deaths (sad, but a fact).
Estoy cansada, pero creo que es por la vacuna	nixxiend	Z_3	I'm tired, but I think it's because of the vaccine	I'm tired, but I think it's because of the vaccine
Perché non mi sorprende la lentezza con la quale l'Italia sta affrontando i primi giorni di vaccinazione? #vaccination	MassimoRozzi	M_134	Why doesn't it surprise me how slowly Italy is tackling the first days of vaccination? #vaccination	Why doesn't it surprise me how slowly Italy is tackling the first days of vaccination? #vaccination
Camionisti no - vax fuori controllo: lOntario dichiara lo stato demergenza -  #Camionisti #fuori #controllo:  	zazoomblog	Z_126	Truckers no - vax out of control: Ontario declares state of emergency - #Truckers #out of #control:	Truckers no - vax out of control: Ontario declares state of emergency - #Truckers #out of #control:
i commenti che mi fanno più ridere sono quelli che dicono che esperti hanno detto che non bisogna farlo e nel momento in cui chiedi loro il nome non rispondono più e quelli che dicono: - ci vogliono ALMENO 3 anni per sviluppare un vaccino	blackh4ired	M_11	the comments that make me laugh the most are those who say that experts have said that it shouldn't be done and when you ask their name they no longer respond and those who say: - it takes AT LEAST 3 years to develop a vaccine	the comments that make me laugh the most are those who say that experts have said that it shouldn't be done and when you ask their name they no longer respond and those who say: - it takes AT LEAST 3 years to develop a vaccine
"Più che delle scorte di ""vaccini"" mi preoccuperei di più delle scorte di gas.  Ma giustamente se ordini più ""vaccini"", poi serve meno gas se i primi fanno il loro corso."	Leonard1306__	CC_82	"More than stocks of ""vaccines"" I would worry more about gas stocks. But rightly so if you order more ""vaccines"", then less gas is needed if the former run their course."	"More than stocks of ""vaccines"" I would worry more about gas stocks. But rightly so if you order more ""vaccines"", then less gas is needed if the former run their course."
Covid: Svizzera, 91/enne morto dopo vaccino, nessun nesso 	sardanews	L_129	Covid: Switzerland, 91 / year old died after vaccine, no connection	Covid: Switzerland, 91 / year old died after vaccine, no connection
Quarta dose ai fragili, avanti piano il primo giorno solo un vaccinato 	infoitinterno	AA_281	Fourth dose to the frail, slowly on the first day only one vaccinated	Fourth dose to the frail, slowly on the first day only one vaccinated
Studiare rende pavidi, ho amici ingegneri che dopo aver fatto calcoli precisi sovradimensionano e medici che consigliano vaccini a perfettamente sani. Noi #nocose invece siamo sicuri e coraggiosi.	Barillarisson	CC_465	Studying makes you fearful, I have engineer friends who, after making precise calculations, oversize and doctors who recommend vaccines to perfectly healthy people. We #nothings, on the other hand, are safe and courageous.	Studying makes you fearful, I have engineer friends who, after making precise calculations, oversize and doctors who recommend vaccines to perfectly healthy people. We #nothings, on the other hand, are safe and courageous.
Il complotto #Covid_19 dimostrato  Il Darwin Awards, il premio assegnato alle morti più stupide dell’anno, si è interrotto nel 2018. Qualcuno (ecco!) doveva aver preavvertito i giurati del prossimo arrivo del Covid e della successione di vittime no-vax convinte del complotto.	mrctrdsh	T_11	The #Covid_19 conspiracy demonstrated The Darwin Awards, the prize awarded to the most stupid deaths of the year, was interrupted in 2018. Someone (here!) must have warned the jurors of the imminent arrival of Covid and the succession of convinced no-vax victims of the conspiracy.	The #Covid_19 conspiracy demonstrated The Darwin Awards, the prize awarded to the most stupid deaths of the year, was interrupted in 2018. Someone (here!) must have warned the jurors of the imminent arrival of Covid and the succession of convinced no-vax victims of the conspiracy.
Moderna +16% on positive CMV vaccine data 	AggarwalTweets	A_340	Moderna +16% on positive CMV vaccine data	Moderna +16% on positive CMV vaccine data
al liceo di mio fratello hanno messo una uscita per i vaccinati e una per i non vaccinati, wtf ma è così ovunque o solo qua?	arvizzibruh	U_179	in my brother's high school they put an exit for the vaccinated and one for the unvaccinated, wtf is it like this everywhere or just here?	in my brother's high school they put an exit for the vaccinated and one for the unvaccinated, wtf is it like this everywhere or just here?
Covid Cina, al via somministrazione primo vaccino inalabile al mondo: (Adnkronos) - Dopo Shanghai anche altre città hanno dato il via libera  	fisco24_info	HH_231	Covid China, the first inhalable vaccine in the world is being administered: (Adnkronos) - After Shanghai, other cities have also given the green light	Covid China, the first inhalable vaccine in the world is being administered: (Adnkronos) - After Shanghai, other cities have also given the green light
Genocidio da #vaccino anti #COVID19 fase 3: terza dose è già arrivata la prima vittima !!!! #AstraZeneca #vaccini #NoGreenPass #NoGreenPassObbligatorio #Draghi #GovernoDraghi #Speranza 	DonatoPorreca	V_39	Genocide from #COVID19 #vaccine phase 3: third dose the first victim has already arrived!!!! #AstraZeneca #vaccini #NoGreenPass #NoGreenPassObligatorio #Draghi #GovernoDraghi #Hope	Genocide from #COVID19 #vaccine phase 3: third dose the first victim has already arrived!!!! #AstraZeneca #vaccini #NoGreenPass #NoGreenPassObligatorio #Draghi #GovernoDraghi #Hope
Covid: Mattarella lascia Spallanzani dopo seconda dose vaccino 	infoitinterno	P_397	Covid: Mattarella leaves Spallanzani after second vaccine dose	Covid: Mattarella leaves Spallanzani after second vaccine dose
Vaccino anti-Covid, a Parma prime dosi al Maggiore 	infoitinterno	L_388	Anti-Covid vaccine, first doses to the Major in Parma	Anti-Covid vaccine, first doses to the Major in Parma
“Giorno della Memoria” 27 gennaio 2022  Provo un pesante odio verso i no vax J-Ax, cantante	PacoLoc98342102	Y_332	Remembrance Day January 27, 2022 I feel a heavy hatred towards the no vax J-Ax, singer	Remembrance Day January 27, 2022 I feel a heavy hatred towards the no vax J-Ax, singer
non ho mai letto mezza critica sensata nei confronti di sarri e dire che di cose da criticare ce ne sono ma c’è modo e modo anche per fare quello ma no sarri potrebbe trovare il vaccino per il covid e certa gente direbbe che allegri l’avrebbe trovato prima	ohmyramsey	G_427	I've never read half a sensible criticism of sarri and to say that there are some things to criticize but there is also a way and a way to do that but no, sarri could find the vaccine for covid and some people would say that happy the would have found sooner	I've never read half a sensible criticism of sarri and to say that there are some things to criticize but there is also a way and a way to do that but no, sarri could find the vaccine for covid and some people would say that happy the would have found sooner
Se dici che i lockdown non servono a nulla, sei un negazionista.  Se dici che il super green pass è discriminatorio, sei un no-vax da incatenare. Se provi a ragionare sulla guerra Russia-Ucraina, sei filo-Putin. Se non dici quello che vogliono loro, sei un nemico da abbattere.	GiuseppePalma78	GG_242	If you say lockdowns are useless, you are a denier. If you say that the super green pass is discriminatory, you are a no-vax to be chained. If you try to think about the Russia-Ukraine war, you are pro-Putin. If you don't tell them what they want, you are an enemy to be brought down.	If you say lockdowns are useless, you are a denier. If you say that the super green pass is discriminatory, you are a no-vax to be chained. If you try to think about the Russia-Ukraine war, you are pro-Putin. If you don't tell them what they want, you are an enemy to be brought down.
"Andrò a vaccinarmi indossando una maglietta con su scritto ""IO NON MI VACCINO""  Coerenza merda, sempre. Non me chiamo Calenda."	RealHumanBean_7	R_402	I'm going to get vaccinated wearing a shirt that says ′′ I DON ' T VACCIN ′′ Consistency shit, always. My name is not Calenda.	I'm going to get vaccinated wearing a shirt that says ′′ I DON ' T VACCIN ′′ Consistency shit, always. My name is not Calenda.
La campagna vaccinale è stata un successo. Il vaccino funziona e i contagi sono diminuiti. Si vede 😂😂😂😂😂 Buffoni!   #STATODIEMERGENZA	Angie_Pinkmeup	X_433	The vaccination campaign was a success. The vaccine works and the infections have decreased. It shows 😂😂😂😂😂 Buffoons! #STATODIEMERGENCY	The vaccination campaign was a success. The vaccine works and the infections have decreased. It shows :face_with_tears_of_joy::face_with_tears_of_joy::face_with_tears_of_joy::face_with_tears_of_joy::face_with_tears_of_joy: Buffoons! #STATODIEMERGENCY
"Coronavirus, a Pomezia si studia il vaccino: ""Così costruiamo le difese dell'uomo"" "	RepubblicaTv	C_11	"Coronavirus, the vaccine is being studied in Pomezia: ""This is how we build man's defenses"""	"Coronavirus, the vaccine is being studied in Pomezia: ""This is how we build man's defenses"""
"Vaccino ai bambini, il Giappone lancia l’allarme: ""Rischio di gravi effetti collaterali""  via ://twitter.com/gparagone"	NelaBombelli	X_389	"Vaccine for children, Japan raises the alarm: ""Risk of serious side effects"" via ://twitter.com/gparagone"	"Vaccine for children, Japan raises the alarm: ""Risk of serious side effects"" via ://twitter.com/gparagone"
Siamo nel mezzo di una pandemia che assorbe gran parte delle risorse ed energie preventive a disposizione del Sistema Sanitario Nazionale. Un problema che colpisce non solo la salute dei bambini ma siconferma anche nelle vaccinazioni dell’adulto e   	salutegreen24	Y_144	We are in the midst of a pandemic that absorbs a large part of the preventive resources and energies available to the National Health System. A problem that affects not only the health of children but is also confirmed in adult vaccinations and	We are in the midst of a pandemic that absorbs a large part of the preventive resources and energies available to the National Health System. A problem that affects not only the health of children but is also confirmed in adult vaccinations and
#ottoemezzo grande #Cacciari #vaccini #multinazionali #speculatori #europa #ristori #licenziamenti ....tutto!	GIULIANA7G	O_136	#ottoemezzo grande #Hunters #vaccines #multinationals #speculators #europe #refreshments #layoffs .... everything!	#ottoemezzo grande #Hunters #vaccines #multinationals #speculators #europe #refreshments #layoffs .... everything!
Terni, addio a Lollo: «Per sempre con noi» | umbriaON un’altro ragazzo vaccinato #fermatequestipazzi #mettevelialculoquestisieridelcazzo 	compierchiogius	W_151	Terni, goodbye to Lollo: «Forever with us» | umbriaON another vaccinated boy #fermatequestipazzi #mettevelialculoquestisieridelcazzo	Terni, goodbye to Lollo: «Forever with us» | umbriaON another vaccinated boy #fermatequestipazzi #mettevelialculoquestisieridelcazzo
Sono finalmente riuscita a prenotarmi il vaccino dopo quasi un mese dato che il CUP della farmacia continuava ad avere problemi con il portale per la mia fascia d’età	wuxlng	S_380	I finally managed to book the vaccine after almost a month as the pharmacy CUP kept having problems with the portal for my age group	I finally managed to book the vaccine after almost a month as the pharmacy CUP kept having problems with the portal for my age group
"Video ""Devo fare questo video perche' ne  ho bisogno. La TV e il vaccino sono le cose che hanno appena ucciso mio padre e stanno facendo lo stesso con mia madre ,ormai moribonda"" "	Vito68122235	FF_377	"Video ""I have to make this video because I need it. TV and the vaccine are the things that just killed my father and are doing the same to my now dying mother"""	"Video ""I have to make this video because I need it. TV and the vaccine are the things that just killed my father and are doing the same to my now dying mother"""
Vaccine vacche time ki herd immunity sadinchela undi society	OnlyFrPSPK	G_465	Vaccine vacche time ki herd immunity sadinchela undi society	Vaccine vacche time ki herd immunity sadinchela undi society
E poi ha secretato i documenti sui vaccini... Cuntachintedemmerda!!! 	BugieAllaRovesc	GG_134	And then he secreted the documents about the vaccines... Contachintedemerda!!!	And then he secreted the documents about the vaccines... Contachintedemerda!!!
Ad oggi Norvegia ha vaccinato 33mila persone.  Secondo il piano vaccinale norvegese, le prime categorie da vaccinare sono:  - ospiti RSA e personale sanitario selezionato  - 85+  - 75-84  2/n  	diabolicus23	M_332	To date, Norway has vaccinated 33,000 people. According to the Norwegian vaccination plan, the first categories to be vaccinated are: - RSA guests and selected healthcare personnel - 85+ - 75-84 2/n	To date, Norway has vaccinated 33,000 people. According to the Norwegian vaccination plan, the first categories to be vaccinated are: - RSA guests and selected healthcare personnel - 85+ - 75-84 2/n
"Covid, Ilaria Capua: ""Vaccino poteva essere pronto in 6 mesi"" "	infoitsalute	G_11	"Covid, Ilaria Capua: ""Vaccine could be ready in 6 months"""	"Covid, Ilaria Capua: ""Vaccine could be ready in 6 months"""
Covid: 2,6 mln di vaccini fermi in frigo, 'no ritardi ma scorte per richiami e nuovi arrivi': Roma, 7 apr. (Adnkronos Salute) - C'è un dato che allarma nella corsa della campagna vaccinale verso l'obiettivo delle 500mila immunizzazioni al giorno: 2,6...  	giornaleradiofm	P_250	Covid: 2.6 million vaccines still in the fridge, 'no delays but stocks for recalls and new arrivals': Rome, 7 April. (Adnkronos Salute) - There is an alarming figure in the race of the vaccination campaign towards the goal of 500,000 immunizations per day: 2.6...	Covid: 2.6 million vaccines still in the fridge, 'no delays but stocks for recalls and new arrivals': Rome, 7 April. (Adnkronos Salute) - There is an alarming figure in the race of the vaccination campaign towards the goal of 500,000 immunizations per day: 2.6...
"Coronavirus, Veneto a contagio zero, ma commissario Arcuri avverte: ""Non è finita, finirà solo quando ci sarà vaccino. Bene App Immuni, scaricatela""  "	ilgiornale	F_336	"Coronavirus, Veneto with zero contagion, but Commissioner Arcuri warns: ""It's not over, it will only end when there is a vaccine. Good Immuni App, download it"""	"Coronavirus, Veneto with zero contagion, but Commissioner Arcuri warns: ""It's not over, it will only end when there is a vaccine. Good Immuni App, download it"""
#andria #news Vaccini, consegnate oggi nella Bat altre 20mila dosi Pfizer - Andria news24city 	andria_news	R_133	#andria #news Vaccines, another 20 thousand Pfizer doses delivered today in the Bat - Andria news24city	#andria #news Vaccines, another 20 thousand Pfizer doses delivered today in the Bat - Andria news24city
Volontaria per vaccino anti Covid, dopo un mese “Mi sento molto bene” 	infoitsalute	F_312	"Volunteer for the anti Covid vaccine, after a month ""I feel very good"""	"Volunteer for the anti Covid vaccine, after a month ""I feel very good"""
È importante che l'Asp di #ReggioCalabria si doti subito di strumenti adeguati per la prenotazione telematica, al fine di evitare code e rischio assembramenti, ripristinando le condizioni di sicurezza per i cittadini fruitori del servizio di vaccinazione. 	g_falcomata	D_450	It is important that the Asp of #ReggioCalabria immediately equip itself with adequate tools for telematic booking, in order to avoid queues and risk of gatherings, restoring the safety conditions for citizens who use the vaccination service.	It is important that the Asp of #ReggioCalabria immediately equip itself with adequate tools for telematic booking, in order to avoid queues and risk of gatherings, restoring the safety conditions for citizens who use the vaccination service.
#Piemonte 12/03/21 ROSSO #COVID  ▪️Terapie intensive: + 4 ▪️Morti: + 1 Dov'è l'emergenza❓  Mi piacerebbe avere due dati da aggiungere:  ▪️Eventi avversi da vaccino: ...... ▪️Morti #NessunaCorrelazione: ......  Grazie a chi vorrà completare questo scema  La rana è bollita	FmMosca	O_310	#Piedmont 12/03/21 RED #COVID ▪️ Intensive care: + 4 ▪️ Deaths: + 1 Where is the emergency ❓ I'd like to have two data to add: ▪️ Adverse vaccine events: ...... ▪️ Deaths #NoCorrelation: ...... Thanks to whoever wants to complete this silly The frog is boiled	#Piedmont 12/03/21 RED #COVID :black_small_square: Intensive care: + 4 :black_small_square: Deaths: + 1 Where is the emergency :red_question_mark: I'd like to have two data to add: :black_small_square: Adverse vaccine events: ...... :black_small_square: Deaths #NoCorrelation: ...... Thanks to whoever wants to complete this silly The frog is boiled
